{
    "configuration_version": 1,
    "active_task": "docs/migration/records/ecmascript-target-lowering.yaml",
    "generated_artifact_registry": "governance/generated-artifacts.json",
    "public_surface_registry": "governance/public-surfaces.json",
    "architecture_rule_registry": "governance/architecture-rules.json",
    "path_evidence": [
        {
            "classification": "semantic_change",
            "paths": [
                "spec/grammar/**",
                "spec/features.json",
                "spec/stdlib/**",
                "tests/spec/**"
            ]
        },
        {
            "classification": "schema_change",
            "paths": ["spec/schema/**", "governance/schemas/**"]
        },
        {
            "classification": "diagnostic_change",
            "paths": ["bindings/**/hint_engine.*", "bindings/**/diagnostics.*"]
        },
        {
            "classification": "target_behavior_change",
            "paths": [
                "bindings/**/emitters/**",
                "core/src/capability_evaluation.rs",
                "core/src/target_serialization.rs",
                "spec/conformance/**",
                "spec/contracts/1.0/examples/**",
                "spec/contracts/1.0/invalid/**",
                "spec/targets/profiles/**",
                "tests/conformance/**",
                "tests/target/**"
            ]
        },
        {
            "classification": "public_api_change",
            "paths": [
                "bindings/c/include/**",
                "bindings/cpp/include/**",
                "bindings/typescript/src/index.ts"
            ]
        },
        {
            "classification": "architecture_change",
            "paths": [
                "governance/architecture.md",
                "governance/architecture-rules.json",
                "governance/schemas/architecture-rules.schema.json",
                "tooling/pcre2_feature_probe.py",
                "tooling/pcre2_runtime_certification.py"
            ]
        }
    ],
    "documentation_paths": ["**/*.md", "docs/**"],
    "internal_implementation_paths": ["tooling/**", "strling", "strling.ps1"]
}
